{
  "schema_version": 1,
  "device_id": "desktop",
  "session_id": "123e4567-e89b-42d3-a456-426614174000",
  "sequence": 1,
  "timestamp_ms": 1792152000000,
  "reason": "startup",
  "heartbeat_interval_ms": 30000,
  "observations": {
    "network_online": null,
    "locked": null,
    "idle": null,
    "active_application": null,
    "audio": null,
    "media": null
  },
  "inference": {
    "activity": "unknown",
    "basis": "insufficient_evidence"
  }
}
